{
  "name": "valid-eval-motion",
  "fps": 30,
  "duration_frames": 120,
  "canvas": {"width": 1080, "height": 1080},
  "source_reference": "flattened-logo.png",
  "source_checksum": "sha256:not-recorded",
  "source_profile": "sRGB",
  "primary_concept": "ORG-01",
  "settle_frame": 96,
  "hold_start_frame": 96,
  "poster_frame": 119,
  "reduced_motion": "Show the approved final state immediately.",
  "background_variants": ["white"],
  "layers": [
    {
      "id": "emblem",
      "role": "core-symbol",
      "source": "flattened-logo.png",
      "bounds": [0.1, 0.1, 0.9, 0.7],
      "pivot": [0.5, 0.6],
      "z_index": 1,
      "start_frame": 0,
      "duration_frames": 90,
      "from": {"x": 0, "y": 0.02, "scale": 0.9, "rotation": 0, "opacity": 0},
      "to": {"x": 0, "y": 0, "scale": 1, "rotation": 0, "opacity": 1},
      "easing": "organic",
      "confidence": "provisional",
      "locked": false,
      "final_state": true
    }
  ]
}
